EDCS-ID,EDH-ID,type_of_inscription_auto,not_before,not_after,clean_text_interpretive_word,occups,occups_N,occups_cats_list
EDCS-08600246,HD001251,epitaph,151.0,250.0,m quinquennali curatori negotiantium vinariorum ium concessum ae Felicitati coniugi Rhodine et Aemilio ccio Severo filio libertis libertabus que,['negotians' 'vinarius' 'curator'],3,"['Retail', 'Food-Retail', 'Managerial']"
EDCS-20402891,,,4.0,14.0,scribendo adfuerunt Quintus Sertorius Quinti filius Atilius Tacitus Publius Rasinius Luci filius Bassus Lucius Lappius Publi filius Gallus Quintus Sertorius Quinti filius Alpius Pica Caius Vettius Luci filius Virgula Marcus Herius Marci filius Priscus Aulus Albius Auli filius Gutta Tiberius Petronius Tiberi filius Pollio Lucius Fabius Luci filius Bassus Sextus Aponius Sexti filius Creticus Caius Canius Cai ilius Saturninus Lucius Otacilius Quinti filius Panthera quod verba facta sunt cum in colonia nostra propter contentiones candidatorum magistratuus non essent ea acta essent quae infra scripta sunt cum ante diem IIII Nonas Apriles allatus esset nuntius Caium Caesarem Augusti patris patriae pontificis maxmi custodis imperii Romani totius que orbis terrarum praesidis filium divi nepotem post consulatum quem ultra finis extremas populi Romani bellum gerens feliciter peregerat bene gesta re publica devicteis aut in fidem receptis bellicosissimis ac maximis gentibus ipsum volneribus pro re publica exceptis ex eo casu crudelibus fatis ereptum populo Romano iam designatum iustissimum ac simillumum parentis sui virtutibus principem coloniae que nostrae unicum praesidium ea que res nondum quieto luctu quem ex decessu Luci Caesaris fratris eius consulis designati auguris patroni nostri principis iuventutis colonia universa susceperat renovasset multiplicasset que maerorem omnium singulorum universorum que ob eas res universi decuriones coloni que quando eo casu in colonia ne que II viri ne que praefecti erant ne que quisquam iure dicundo praeerat inter sese consenserunt pro magnitudine tantae ac tam improvisae calamitatis oportere ex ea die qua eius decessus nuntiatus esset usqu ad eam diem qua ossa relata at que condita iusta que eius Manibus perfecta essent cunctos veste mutata templis que deorum immortalium balneis que publicis et tabernis omnibus clausis convictibus sese apstinere matronas quae in colonia nostra sunt sublugere diem que eum quo die Caius Caesar obiit qui dies est ante diem VIIII Kalendas Martias pro Alliensi lugubrem memoriae prodi notari que in praesentia omnium iussu ac voluntate caveri que ne quod sacrificium publicum neve quae supplicationes nive sponsalia nive convivia publica postea in eum diem eove die qui dies erit ante diem VIIII Kalendas Martias fiant concipiantur indicanturve nive qui ludi scaenici circiensesve eo die fiant spectenturve uti que eo die quodannis publice Manibus eius per magistratus eosve qui Pisis iure dicundo praeerunt eodem loco eodem que modo quo Lucio Caesari parentari institutum est parentetur uti que ianus celeberrimo coloniae nostrae loco constituatur ornatus spoleis devictarum aut in fidem receptarum ab eo gentium super eum statua pedestris ipsius triumphali ornatu circa que eam duae equestres inauratae Gai et Luci Caesarum statuae ponantur uti que cum primum per legem coloniae duoviros creare et habere potuerimus ii duoviri qui primi creati erunt hoc quod decurionibus et universis colonis placuit ad decuriones referant eorum publica auctoritate adhibita legitume id caveatur auctoribus que iis in tabulas publicas referatur interea Titus Statulenus Iuncus flamen Augustalis pontifex minor publicorum populi Romani sacrorum rogaretur uti cum legatis excusata praesenti coloniae necessitate hoc officium publicum et voluntatem universorum libello reddito Imperatori Caesari Augusto patri patriae pontifici maximo tribuniciae potestatis XXVI indicet id que Titus Statulenus Iuncus princeps coloniae nostrae flamen Augustalis pontifex minor publicorum populi Romani sacrorum libello ita uti supra scriptum est Imperatori Caesari Augusto pontifici maximo tribuniciae potestatis XXVI patri patriae reddito fecerit placere conscriptis quae ante diem IIII Nonas Apriles quae Sexto Aelio Cato Caio Sentio Saturnino consulibus fuerunt facta acta constituta sunt per consensum omnium ordinum ea omnia ita fieri agi haberi observari que ab Lucio Titio Auli filio et Tito Allio Titi filio Rufo II viris et ab eis quicum que postea in colonia nostra II viri praefecti sive qui alii magistratus erunt omnia in perpetuom ita fieri agi haberi oservari que uti que Lucius Titius Auli filius Titus Allius Titi filius Rufus II viri ea omnia quae supra scripta sunt ex decreto nostro coram pro quaestoribus primo quo que tempore per scribam publicum in tabulas publicas referenda curent censuere,['candidator' 'scaenicus' 'scriba'],3,"['Clothing', 'Performing Arts', 'Education']"
EDCS-20402907,,epitaph,101.0,200.0,Dis Manibus Venuleia Pelagia hic adquiescit filius matri piissimae Marcus Naevius Marci filius Galeria Restitutus miles cohortis X praetoriae hic adquiescit qui reliquit testamento collegio fabrum navalium Pisanorum stationi vetustissimae et piissimae HS IIIImilia nummum ex cuius reditu parentalia et rosaria quotannis a sepulcrum suum celebrent quot si factum ab eis non esset tunc ea ipsa condicione fabri tignarii Pisani acceptis pro poena a fabris navalibus HS IIIImilibus nummum ipsi celebrare debebunt,['faber tignarius' 'faber navalis' 'navalis' 'faber'],4,"['Building', 'Transport', 'Transport', 'Unclassified']"
EDCS-20402916,,epitaph,101.0,200.0,Dis Manibus Mettia Ianuaria hic adquiescit coniugi bene merenti Quintus Obsequientius Severinus Augustalis Pisis curator kalendarii Florentinorum sibi posteris que suis,['curator'],1,['Managerial']
EDCS-20402920,,epitaph,101.0,200.0,Dis Manibus Anniae Iucundae Marci Anni Proculi matris Dis Manibus Marco Annio Marci filio Palatina Proculo decurioni coloniae Ostiensis flamini divi Vespasiani patrono fabrum navalium Ostiensium vixit annos XXV menses VI dies XXVIII horas IIII,['faber navalis'],1,['Transport']
EDCS-20402971,,epitaph,101.0,200.0,Dis Manibus Caius Veianius Helittas fecit sibi se vio et Claudiae Euploeae coniugi suae quis autem post obitum nostrum voluerit corpus supra ponere vel sarcofagum vexare hic inferet aerario populi Romani HS XXV milia nummum,['aerarius'],1,['Metal-Working']
